{"schema_version": "1.0.0", "source_phase_4d": {"surface_id": "SURF-FIXTURE-000001", "canonical_mesh_sha256": "9da47db63cb6ecab96e9a1f739e53c5f9636e8eaa2ccb3388ac9e1992be907e4", "phase_4d_output_closure_sha256": "4d92e539242df9a776d7d7565605c28379a85588c352fc58d773200f8dec32d4", "phase_4d_algorithm_id": "PHASE4D_BOWYER_WATSON_2P5D_v1", "phase_4d_configuration_digest": "aaaaaaaaaaaaaaaaaaaaaaaaaaaaaaaaaaaaaaaaaaaaaaaaaaaaaaaaaaaaaaaa"}, "device": {"manufacturer": "Apple", "model_identifier": "iPad13,8", "marketing_name": "iPad Pro 12.9 (6th Gen)", "os_version": "16.0", "sensor_profile_id": "SP-LIDAR-01", "calibration_profile_id": "CP-01"}, "declared_operating_envelope": {"envelope_id": "ENV-01", "working_distance_range_meters": [0.5, 1.5], "ambient_lux_range": [300, 1000], "max_incidence_angle_deg": 60}, "scale_anchors": [{"anchor_id": "SA-02", "anchor_type": "DISTRIBUTED_TARGET_ARRAY", "calibration_certificate_id": "CERT-9", "calibration_state": "VALID", "valid_from": "2026-01-01T00:00:00Z", "valid_until": "2026-06-01T00:00:00Z", "nominal_features": [{"feature_id": "F-A", "position_mm": [0, 0, 0], "standard_uncertainty_mm": [0.1, 0.1, 0.1]}, {"feature_id": "F-B", "position_mm": [864, 0, 0], "standard_uncertainty_mm": [0.1, 0.1, 0.1]}]}], "datums": [{"datum_id": "D-1", "datum_type": "PRIMARY_PLANE", "source_frame_id": "FRAME_RECONSTRUCTION_ROOT", "target_frame_id": "FRAME_VEHICLE", "handedness": "RIGHT_HANDED", "origin_definition": "rail-midpoint", "axis_definition": {"x_positive": "toward-front", "y_positive": "up", "z_positive": "toward-left"}, "reference_features": ["F-A", "F-B"]}], "physical_controls": [{"control_id": "CP-03", "feature_a_id": "F-A", "feature_b_id": "F-B", "reference_value_mm": 864.0, "standard_uncertainty_mm": 0.2, "instrument_id": "CMM-1", "instrument_calibration_id": "CAL-CMM-1", "procedure_id": "PROC-1", "operator_id": "OP-1", "measured_at": "2026-08-04T10:00:00Z", "use_role": "VALIDATION_ONLY"}], "manual_measurements": [{"measurement_id": "M_RAIL_SPACING_01", "feature_a_id": "F-A", "feature_b_id": "F-B", "region_id": "REG_REAR_BATTERY_MOUNT", "value_mm": 864.2, "tool_type": "LASER_DISTANCE_METER", "tool_uncertainty_mm": 1.0, "uncertainty_interpretation": "EXPANDED_UNCERTAINTY", "instrument_id": "LDM-1", "operator_id": "OP-1", "measured_at": "2026-08-04T10:05:00Z"}]}
